{
  "schema_version": "s7-http-session-v1",
  "run_id": "7c1e5a10-0f2e-4c44-9d4a-3f2b8a9c1d22",
  "base_origin": "http://127.0.0.1:49152",
  "started_at": "2026-09-05T04:00:00Z",
  "completed_at": "2026-09-05T04:00:01Z",
  "token_redacted": true,
  "entries": [
    {
      "method": "PUT",
      "object_key": "MDEyMzQ1Njc4OWFiY2RlZg",
      "request_bytes": 416,
      "response_status": 201,
      "response_bytes": 0,
      "duration_ms": 3
    },
    {
      "method": "GET",
      "object_key": "MDEyMzQ1Njc4OWFiY2RlZg",
      "request_bytes": 0,
      "response_status": 200,
      "response_bytes": 416,
      "duration_ms": 1
    },
    {
      "method": "HEAD",
      "object_key": "YWJjZGVmZ2hpamtsbW5vcA",
      "request_bytes": 0,
      "response_status": 404,
      "response_bytes": 0,
      "duration_ms": 1
    }
  ]
}
